,sentence_id,target_index,target_word,synset,context_before,context_after,synset_is_correct,full_sentence,len_sentence,target_word_pos,baseline_random,baseline_first,baseline_last,synonym_similarity,hypernym_similarity,hyponym_similarity,most_common_def_similarity,less_common_def_similarity,f0_synset_frequency,f1_overlapping_words,f2_synset_and_context_after,f3_synset_and_context_before,f4_synset_and_target_similarity,f5_target_and_synset_definition,f6_synset_and_sentence_similarity,f7_target_word_and_sentence_similarity,f8_synset_example_and_sentence_similarity,f9_synset_definition_and_sentence_similarity,f10_lesk_pred_and_target_similarity,model_pred
29661,brown1/tagfiles/br-f43.xml_63,30,find,find.v.01,"As the robbers leave the looted train , the film suddenly cuts back to the station , where the telegrapher 's little daughter arrives with her father 's dinner pail only to",him bound on the floor .,True,"As the robbers leave the looted train , the film suddenly cuts back to the station , where the telegrapher 's little daughter arrives with her father 's dinner pail only to find him bound on the floor .",202,VB,find.v.03,discovery.n.01,find_oneself.v.01,0.26330125693164413,0.18400143429666196,0.15926172679177883,0.1799654245185707,0.23158227803138023,2,1,0.21129935324975505,0.30638607335495055,1.0000000000000002,0.3764466550840267,0.3520206077880899,0.3520206077880899,0.7266716462062818,0.7520707368802446,1.0000000000000002,False
10176,brown1/tagfiles/br-c01.xml_57,14,find,find.v.03,"If there is a moral lurking among the shenanigans , it is hard to",.,True,"If there is a moral lurking among the shenanigans , it is hard to find .",72,VB,line_up.v.02,discovery.n.01,find_oneself.v.01,0.26330125693164413,0.18400143429666196,0.15926172679177883,0.1799654245185707,0.23158227803138023,4,2,0.03516840684776777,0.33553977643781646,1.0000000000000002,0.48231786905363255,0.4209147654138057,0.4209147654138057,0.7080582775270798,0.7958553216330879,0.2911598664687784,False
48069,brown1/tagfiles/br-j12.xml_86,7,follows,follow.v.04,"In type 1 , the pulmonary vein closely",the course of the bronchus and the pulmonary artery from the periphery to the hilum .,True,"In type 1 , the pulmonary vein closely follows the course of the bronchus and the pulmonary artery from the periphery to the hilum .",132,VBZ,play_along.v.02,postdate.v.01,stick_to.v.02,0.10411993952215973,0.07692206364719555,0.0637476780283757,0.1987843495248446,0.07542456598567722,3,1,0.1839228792222389,0.27156262516764385,0.5262914988294998,0.2367431613588293,0.26078713774613443,0.2932812849189627,0.6174424836146288,0.6533229960007783,0.08731487608864659,False
47412,brown1/tagfiles/br-j12.xml_26,4,followed,follow.v.04,This vessel could be,"to the parenchyma where it directly provided bronchial arterial blood to the alveolar capillary bed ( figs. 17 , 18 ) .",True,"This vessel could be followed to the parenchyma where it directly provided bronchial arterial blood to the alveolar capillary bed ( figs. 17 , 18 ) .",149,VBD,surveil.v.01,postdate.v.01,stick_to.v.02,0.10694442965947346,0.07040292488255089,0.07723343236819771,0.2497309625305537,0.0680961413326173,3,0,0.16505035111749586,0.25245656945331557,0.5744173108186799,0.23216483009350228,0.24246269170910748,0.21906928738510945,0.41722595482001146,0.6447664284642406,0.2535688094105358,False
30588,brown1/tagfiles/br-g01.xml_47,20,following,follow.v.08,"Probably a larger percentage of Virginians and South Carolinians remain unreconstructed than elsewhere , with Georgia , North Carolina , and Alabama",along after them .,True,"Probably a larger percentage of Virginians and South Carolinians remain unreconstructed than elsewhere , with Georgia , North Carolina , and Alabama following along after them .",177,VBG,come.v.05,pursuit.n.01,following.s.04,0.13017766732157124,0.07182290178898404,0.0694097277573479,0.1679510068994977,0.32688711633756234,9,0,0.3098789820866961,0.16185794360308453,0.46690433738278847,0.26585798696852386,0.22086576563920166,0.24361458523173216,0.8561777379103498,0.2810066032888287,1.0,False
46257,brown1/tagfiles/br-j11.xml_13,9,followed,follow.v.08,"The African rock python , a close second , is",in turn by the reticulate python .,True,"The African rock python , a close second , is followed in turn by the reticulate python .",89,VBD,follow.v.18,postdate.v.01,stick_to.v.02,0.10694442965947346,0.07040292488255089,0.07723343236819771,0.2497309625305537,0.0680961413326173,7,0,0.25769735448493497,0.17023177457981997,0.5744173108186799,0.19096408219986485,0.2830406526013809,0.33518842933067317,0.7792793585048449,0.4017221002679081,0.06250710819315473,False
9054,brown1/tagfiles/br-b20.xml_33,15,running,function.v.01,"R. H. S. Crossman , M.P. , writing in The Manchester Guardian , states that departures from West Berlin are now","at the rate not of 700 , but of 1700 a week , and applications to leave have risen to 1900 a week .",True,"R. H. S. Crossman , M.P. , writing in The Manchester Guardian , states that departures from West Berlin are now running at the rate not of 700 , but of 1700 a week , and applications to leave have risen to 1900 a week .",219,VBG,run.v.19,run.n.07,running.s.06,0.15454407253028693,0.11765875401562739,0.12190412252331372,0.28258283280012386,0.16686484550178457,11,0,0.14731945598782475,0.14267924007812172,0.09363136598001641,0.1985695056437319,0.14953761036437502,0.22165059874129822,0.3910861956961445,0.2821277148681975,0.32217527266452445,False
40407,brown1/tagfiles/br-j06.xml_19,3,fused,fuse.v.02,The silver chloride was,under vacuum in the presence of aluminum chips with the resultant product of * * f which was sublimed into a flask on the vacuum line .,True,The silver chloride was fused under vacuum in the presence of aluminum chips with the resultant product of * * f which was sublimed into a flask on the vacuum line .,165,VBN,fuse.v.02,fuse.v.02,amalgamate.s.01,0.2963331615801885,0.06640384994119629,0.0917684009474349,0.3856404067658588,0.2220613246052925,1,0,0.17638913818057744,0.08854144151392766,0.5390656468546231,0.19347042193962058,0.20992742933623837,0.16904163284936172,0.7353917656890807,0.663738019756876,0.5390656468546231,False
27909,brown1/tagfiles/br-f19.xml_34,14,make,gain.v.08,"Naturally , such scholarly facts are of little concern to the man trying to",money or fan patriotism by means of folklore .,True,"Naturally , such scholarly facts are of little concern to the man trying to make money or fan patriotism by means of folklore .",127,VB,take.v.27,shuffle.n.01,make.v.49,0.2008609841717637,0.22886484876178495,0.16696423421055445,0.26406540048252963,0.22447328469666636,11,1,0.15171132560266526,0.16760807659054616,0.19296005490722212,0.41841170165596087,0.18483759143889023,0.36041500592556436,0.7565771931022641,0.5924910061717278,1.0000000000000002,False
8394,brown1/tagfiles/br-b13.xml_92,23,make,gain.v.08,Investors breathed more freely when it was learned that this acrobatic dancer had turned magician and was only doing a best seller book to,some dough .,True,Investors breathed more freely when it was learned that this acrobatic dancer had turned magician and was only doing a best seller book to make some dough .,156,VB,make.v.32,shuffle.n.01,make.v.49,0.2008609841717637,0.22886484876178495,0.16696423421055445,0.26406540048252963,0.22447328469666636,11,1,0.11952927716788904,0.2352435208426247,0.19296005490722212,0.41841170165596087,0.23952080796312394,0.4448949599521862,0.7592702583759073,0.6056263485946141,1.0000000000000002,False
42744,brown1/tagfiles/br-j08.xml_12,4,gathered,gather.v.01,Much information has been,relative to quantitative sampling and assessment techniques .,True,Much information has been gathered relative to quantitative sampling and assessment techniques .,96,VBN,accumulate.v.02,meet.v.07,collected.a.01,0.19698526844094186,0.06489700728878348,0.0944552012736482,0.24730062232388855,0.27111598145843185,0,0,0.1019660843451736,0.06782197146205914,0.7317625560404861,0.24730062232388855,0.22964704543075265,0.2593684868354715,0.3604462416770289,0.2351872143391592,0.7317625560404861,False
10977,brown1/tagfiles/br-c02.xml_19,2,gathered,gather.v.01,NBC had,a lot of historical material which it was eager to share .,True,NBC had gathered a lot of historical material which it was eager to share .,75,VBN,gain.v.07,meet.v.07,collected.a.01,0.19698526844094186,0.06489700728878348,0.0944552012736482,0.24730062232388855,0.27111598145843185,0,0,0.14877503373798875,0.027820264127811332,0.7317625560404861,0.24730062232388855,0.2260189039379612,0.258307224933306,0.4188183302667428,0.3206362238001107,0.16557851604161503,False
42540,brown1/tagfiles/br-j07.xml_85,23,collected,gather.v.01,A measure of the total mass accretion of meteoritic material by the Earth is obtained from analyses of deep sea sediments and dust,"in remote regions ( Pettersson , 1960 ) .",True,"A measure of the total mass accretion of meteoritic material by the Earth is obtained from analyses of deep sea sediments and dust collected in remote regions ( Pettersson , 1960 ) .",182,VBN,gather.v.01,collect.v.02,collected.s.02,0.16733885685367295,0.126705488024038,0.09117599324708653,0.2666898267840968,0.024481409701071735,2,0,0.03947949896472012,0.14986349603177768,0.36274382895807983,0.17583383800013885,0.13612289003731576,0.21069730384013413,0.328283913129925,0.22587427713545163,1.0000000000000002,False
20610,brown1/tagfiles/br-e04.xml_39,3,acquired,get.v.01,( Babin has,"some of Schnabel 's keyboard manner , but his playing is of limited insight . )",True,"( Babin has acquired some of Schnabel 's keyboard manner , but his playing is of limited insight . )",100,VBN,get.v.01,assume.v.03,acquired.s.01,0.19209861577872006,0.15994473065752793,0.03852676644447372,0.07388365176701144,0.15553889352208203,0,1,0.1991885719273776,0.0664196745318737,0.02001483586826017,0.07388365176701144,0.17708064210886992,0.07316956253646033,0.6546721191288922,0.5339699667548109,0.11812643794886882,False
1377,brown1/tagfiles/br-a02.xml_24,3,getting,get.v.01,`` We 're,"more ' pro ' letters than ' con ' on horse race betting '' , said Ratcliff .",True,"`` We 're getting more ' pro ' letters than ' con ' on horse race betting '' , said Ratcliff .",94,VBG,get.v.03,get.v.01,beget.v.01,0.14201362314208613,0.10585350785813927,0.09951866269035743,0.3161044278865616,0.26918130759751674,1,0,0.16238258672483705,0.18234207500054941,0.7506690379303163,0.33505679674124633,0.22832372235259202,0.25994621775110416,0.6609495975124702,0.5169855863879764,0.04935915198873621,False
1707,brown1/tagfiles/br-a02.xml_56,16,get,get.v.01,Cotten construed this as a veiled effort by Parkhouse to help Dallas and other large cities,money which Cotten felt could better be spent providing water for rural Texas .,True,Cotten construed this as a veiled effort by Parkhouse to help Dallas and other large cities get money which Cotten felt could better be spent providing water for rural Texas .,175,VB,get.v.20,get.v.01,beget.v.01,0.21756989903442617,0.1796043039271046,0.16174000963690255,0.37344205776605954,0.4043051450535392,1,0,0.39583702206294175,0.16417247394910459,1.0,0.43404663724431825,0.3470459133228846,0.3470459133228846,0.6672152074499579,0.667861084645569,1.0,False
18240,brown1/tagfiles/br-e01.xml_44,1,has,get.v.03,He,Henri do from four to six sets of the Incline Bench Press ( note the high incline ) .,True,He has Henri do from four to six sets of the Incline Bench Press ( note the high incline ) .,92,VBZ,have.v.17,have.v.01,take.v.35,0.07300858302795371,0.05856038595405621,0.04221766750056804,0.22191392999106513,0.27238063666698226,5,1,0.24177626799987997,0.3187595608109218,0.11333426193497773,0.17953468413436535,0.2708685690746153,0.30601028177014583,0.5304370881263948,0.7933994209934464,0.049981335746601574,False
24066,brown1/tagfiles/br-e24.xml_104,6,have,get.v.03,"After it has been seen ,","the child start on a mat on hands and knees ( a thin , inexpensive mat is quite sufficient for anything that does not require falling ) .",True,"After it has been seen , have the child start on a mat on hands and knees ( a thin , inexpensive mat is quite sufficient for anything that does not require falling ) .",167,VB,have.v.10,have.v.01,take.v.35,0.22225699163046142,0.15268625752582207,0.1425637831621209,0.2976118735013364,0.5473088497853392,5,1,0.3451261606430296,0.2887549300681472,0.4150245767243859,0.3584817363687925,0.3711106732953084,0.49195518339151467,0.5461417488784578,0.8095484633240717,1.0,False
10056,brown1/tagfiles/br-c01.xml_38,2,started,get_down.v.07,So I,making some calls of my own .,True,So I started making some calls of my own .,42,VBN,depart.v.03,begin.v.03,start.v.14,0.08410832114716811,0.12316754890763176,0.045479982694048064,0.3027190506304046,0.14122297387800445,0,0,0.6482108041716097,0.10045575829793194,-0.019138983992618434,0.3027190506304046,0.5228387010817145,0.4258119522721499,0.5013187969146743,0.5105546416586813,0.5440902515455591,False
21369,brown1/tagfiles/br-e21.xml_4,0,Begin,get_down.v.07,,the examination of a site with a good map and aerial photos if possible .,True,nan Begin the examination of a site with a good map and aerial photos if possible .,83,VB,begin.v.07,get_down.v.07,begin.v.10,0.2353272818041322,0.09396459810772216,0.09435441752775943,0.07146393979409735,0.20188783237237878,1,1,0.7744858153405918,1.0,0.06271773476955451,0.3165899807667931,0.8044662516477374,0.2587969557260534,0.3276771578484585,0.4792599636040198,1.0000000000000002,False
31194,brown1/tagfiles/br-g11.xml_5,18,gives,give.v.01,"For the family is the simplest example of just such a unit , composed of people , which","us both some immunity from , and a way of dealing with , other people .",True,"For the family is the simplest example of just such a unit , composed of people , which gives us both some immunity from , and a way of dealing with , other people .",165,VBZ,give.v.07,give.v.01,give.v.44,0.12305916150689929,0.11416959678324348,0.09196983339531276,0.20058389272400373,0.04830241681878015,1,1,0.18970306885311297,0.194622994008122,0.6701964593050144,0.20376234808729066,0.23782314632582097,0.25653961695190036,0.6558783150659523,0.7959144731738724,0.6701964593050144,False
16797,brown1/tagfiles/br-d04.xml_31,29,given,give.v.03,"`` So that the man should not have thoughts of grandeur , and become lifted up , as if he had no lord , because of the dominion that had been","to him , and the freedom , fall into sin against God his Creator , overstepping his bounds , and take up an attitude of self-conceited arrogance towards God , a law was given him by God , that he might know that he had for lord the lord of all .",True,"`` So that the man should not have thoughts of grandeur , and become lifted up , as if he had no lord , because of the dominion that had been given to him , and the freedom , fall into sin against God his Creator , overstepping his bounds , and take up an attitude of self-conceited arrogance towards God , a law was given him by God , that he might know that he had for lord the lord of all .",393,VBN,give.v.04,give.v.01,apt.s.01,0.16258728140840567,0.12838842006131138,0.10001494064305375,0.5622128720990669,0.17726395586690755,3,2,0.27731214739668225,0.2908435669177336,0.646258164670123,0.19191668452384625,0.3026371927629592,0.32727358145821994,0.4731521620939284,0.7444232985443454,0.10272639400484035,False
1533,brown1/tagfiles/br-a02.xml_41,5,given,give.v.03,Natural gas public utility companies would be,"the right of eminent domain , under a bill by Sen. Frank Owen /3 , of El Paso , to acquire sites for underground storage reservoirs for gas .",True,"Natural gas public utility companies would be given the right of eminent domain , under a bill by Sen. Frank Owen /3 , of El Paso , to acquire sites for underground storage reservoirs for gas .",193,VBN,give.v.38,give.v.01,apt.s.01,0.16258728140840567,0.12838842006131138,0.10001494064305375,0.5622128720990669,0.17726395586690755,3,2,0.15177824311221805,0.21885516792865103,0.646258164670123,0.19191668452384625,0.2206119448109948,0.24933533725126156,0.2974654047118342,0.6950071530889911,0.09164693288404989,False
33060,brown1/tagfiles/br-g15.xml_53,27,given,give.v.04,"Life is further characterized , in antithesis to Piepsam , as animal : the image of a dog , which appears at several places , is first","as the criterion of amiable , irrelevant interest aroused by life considered simply as a spectacle : a dog in a wagon is `` admirable '' , `` a pleasure to contemplate '' ; another wagon has no dog , and therefore is `` devoid of interest '' .",True,"Life is further characterized , in antithesis to Piepsam , as animal : the image of a dog , which appears at several places , is first given as the criterion of amiable , irrelevant interest aroused by life considered simply as a spectacle : a dog in a wagon is `` admirable '' , `` a pleasure to contemplate '' ; another wagon has no dog , and therefore is `` devoid of interest '' .",384,VBN,give.v.21,give.v.01,apt.s.01,0.16258728140840567,0.12838842006131138,0.10001494064305375,0.5622128720990669,0.17726395586690755,4,0,0.10696690316584455,0.12407887386778158,0.646258164670123,0.27837622761129516,0.13064696177532373,0.21572515487050611,0.3105672721276888,0.2836419461258229,0.646258164670123,False
26745,brown1/tagfiles/br-f10.xml_30,6,given,give.v.04,For Mrs. Shaefer - who had been,a clean bill of health by her own physician at the time she visited Lee - and her friend were agents for the California Pure Food and Drug Inspection Bureau .,True,For Mrs. Shaefer - who had been given a clean bill of health by her own physician at the time she visited Lee - and her friend were agents for the California Pure Food and Drug Inspection Bureau .,196,VBN,give.v.31,give.v.01,apt.s.01,0.16258728140840567,0.12838842006131138,0.10001494064305375,0.5622128720990669,0.17726395586690755,4,0,0.20717598351844388,0.2056120360767764,0.646258164670123,0.27837622761129516,0.24919543437892372,0.2904021824324803,0.3562057143277932,0.3383767404764277,0.09164693288404989,False
33669,brown1/tagfiles/br-h01.xml_22,2,given,give.v.04,Advice is,also on problems of plant location and plant space .,True,Advice is given also on problems of plant location and plant space .,68,VBN,give.v.03,give.v.01,apt.s.01,0.16258728140840567,0.12838842006131138,0.10001494064305375,0.5622128720990669,0.17726395586690755,4,0,0.1447883762673707,0.14894088461059438,0.646258164670123,0.27837622761129516,0.2729419841282739,0.3338938996775396,0.32449181576198033,0.32000235068210864,0.09164693288404989,False
37335,brown1/tagfiles/br-j03.xml_56,12,given,give.v.04,"The direction of the tension of minimum pressure is , of course ,",by the direction of the major axis of the ellipsoids .,True,"The direction of the tension of minimum pressure is , of course , given by the direction of the major axis of the ellipsoids .",126,VBN,give.v.03,give.v.01,apt.s.01,0.16258728140840567,0.12838842006131138,0.10001494064305375,0.5622128720990669,0.17726395586690755,4,0,0.13002334162215884,0.13144384102788692,0.646258164670123,0.27837622761129516,0.18250621440978032,0.24246556523786333,0.3125461259883184,0.26742539696024675,0.09164693288404989,False
26193,brown1/tagfiles/br-f03.xml_56,11,given,give.v.04,"We may conclude that all six points of information , ostensibly","by the dream priest , could have been furnished by Dr. Hilprecht 's subconscious reasoning .",True,"We may conclude that all six points of information , ostensibly given by the dream priest , could have been furnished by Dr. Hilprecht 's subconscious reasoning .",162,VBN,give.v.34,give.v.01,apt.s.01,0.16258728140840567,0.12838842006131138,0.10001494064305375,0.5622128720990669,0.17726395586690755,4,1,0.15586927421121818,0.24635565013182625,0.646258164670123,0.27837622761129516,0.25133884556472225,0.32428905289996873,0.3702848859816294,0.38677343283313087,0.09164693288404989,False
32784,brown1/tagfiles/br-g15.xml_30,24,give,give.v.04,"There is no more `` plot '' than that ; only slightly more , perhaps , than a newspaper account of such an incident would",.,True,"There is no more `` plot '' than that ; only slightly more , perhaps , than a newspaper account of such an incident would give .",128,VB,give.v.40,give.v.01,give.v.44,0.2070658133929592,0.17807852303399796,0.13688379315120497,0.19626429559236233,-0.0004891714501663401,4,0,-0.01236157762927133,0.19586331744801103,1.0,0.396809391835515,0.25480471394300747,0.25480471394300747,0.361994546382889,0.37157350879960027,1.0,False
12744,brown1/tagfiles/br-c04.xml_85,4,give,give.v.04,The answers the girls,struck me as reasonably varied and healthily individual .,True,The answers the girls give struck me as reasonably varied and healthily individual .,84,VB,yield.v.01,give.v.01,give.v.44,0.2070658133929592,0.17807852303399796,0.13688379315120497,0.19626429559236233,-0.0004891714501663401,4,0,0.20919237872568822,0.2164155310335831,1.0,0.396809391835515,0.40112378527077214,0.40112378527077214,0.4676213835476025,0.4419966276046912,1.0,False
4662,brown1/tagfiles/br-a13.xml_33,12,gave,give.v.09,Jim Landis ' 380 - foot home run over left in the first inning,"the Sox a 1 - 0 lead , but Harmon Killebrew came back in the bottom of the first with his second homer in two days with the walking Bob Allison aboard .",True,"Jim Landis ' 380 - foot home run over left in the first inning gave the Sox a 1 - 0 lead , but Harmon Killebrew came back in the bottom of the first with his second homer in two days with the walking Bob Allison aboard .",220,VBD,give.v.28,yield.v.01,give.v.44,0.12116731107439395,0.09686021526373007,0.08183683466353016,0.13560603886683706,0.010994337161279033,8,0,0.22917447209230116,0.18402427319787704,0.7412387808321047,0.13909023327880296,0.24737123815540787,0.3205043398498665,0.7879842932433482,0.5567472388939362,0.7412387808321047,False
4203,brown1/tagfiles/br-a12.xml_93,8,gave,give.v.09,Texas ' 545 - yard spree against Washington State,the Longhorns a 3 - game total offense of 1512 yards ( 1065 rushing and 447 passing ) a new SWC high .,True,Texas ' 545 - yard spree against Washington State gave the Longhorns a 3 - game total offense of 1512 yards ( 1065 rushing and 447 passing ) a new SWC high .,157,VBD,give.v.44,yield.v.01,give.v.44,0.12116731107439395,0.09686021526373007,0.08183683466353016,0.13560603886683706,0.010994337161279033,8,0,0.06270632075547389,0.04341211836928907,0.7412387808321047,0.13909023327880296,0.09645389784495559,0.13361127963625816,0.5081545967856232,0.4416189336607855,0.10410399256372993,False
15327,brown1/tagfiles/br-d02.xml_60,82,give,give.v.10,"It will be recalled from the discussion in Section 7 that the position of the `` right '' , as represented by Barth , rests on the following thesis : The only tenable alternative to Bultmann 's position is a theology that ( 1 ) rejects or at least qualifies his unconditioned demand for demythologization and existential interpretation ; ( 2 ) accepts instead a special biblical hermeneutics or method of interpretation ; and ( 3 ) in so doing , frees itself to","appropriate emphasis to the event Jesus Christ by means of statements that , from Bultmann 's point of view , are mythological .",True,"It will be recalled from the discussion in Section 7 that the position of the `` right '' , as represented by Barth , rests on the following thesis : The only tenable alternative to Bultmann 's position is a theology that ( 1 ) rejects or at least qualifies his unconditioned demand for demythologization and existential interpretation ; ( 2 ) accepts instead a special biblical hermeneutics or method of interpretation ; and ( 3 ) in so doing , frees itself to give appropriate emphasis to the event Jesus Christ by means of statements that , from Bultmann 's point of view , are mythological .",595,VB,collapse.v.01,give.v.01,give.v.44,0.2070658133929592,0.17807852303399796,0.13688379315120497,0.19626429559236233,-0.0004891714501663401,10,0,0.12454311090240405,0.1956474789698854,1.0,-0.01236157762927133,0.1989355101915245,0.1989355101915245,0.6873806624265207,0.8319796180307045,1.0,False
27105,brown1/tagfiles/br-f10.xml_61,5,given,give.v.20,Sarah Gross found that the treatments,her for a nervous ailment by the masseur were not helping her .,True,Sarah Gross found that the treatments given her for a nervous ailment by the masseur were not helping her .,107,VBN,give.v.07,give.v.01,apt.s.01,0.16258728140840567,0.12838842006131138,0.10001494064305375,0.5622128720990669,0.17726395586690755,20,0,0.28067804899604104,0.19323597194136077,0.646258164670123,0.48911729154853006,0.3337369808290808,0.38214991727585296,0.6383748078062427,0.48102432391822636,0.9999999999999998,False
19629,brown1/tagfiles/br-e02.xml_69,6,go,go.v.02,Here is a word of advice when you,shopping for your pansy seeds .,True,Here is a word of advice when you go shopping for your pansy seeds .,68,VB,plump.v.04,adam.n.03,go.a.01,0.19973774860653212,0.20041529304480413,0.16375896888266236,0.3806108047379982,0.2921502706855514,5,1,0.28969431651333494,0.3489599865267171,0.9999999999999998,0.4753681398970958,0.4827201339189594,0.4827201339189594,0.7036891886257727,0.6805696978423322,0.9999999999999998,False
1080,brown1/tagfiles/br-a02.xml_2,5,went,go.v.02,"Under committee rules , it",automatically to a subcommittee for one week .,True,"Under committee rules , it went automatically to a subcommittee for one week .",78,VBD,go.v.03,go.v.02,fail.v.04,0.1038303419881525,0.09293169268624746,0.08335847298854905,0.06632331518344836,0.1401718599066928,1,1,0.25484066695955565,0.2806548587479805,0.5646423175914026,0.23321869903678993,0.3628930166528758,0.3142731809590291,0.5693399188865987,0.7543325411193794,0.021330516017922733,False
