,sentence_id,target_index,target_word,synset,context_before,context_after,synset_is_correct,full_sentence,len_sentence,target_word_pos,baseline_random,baseline_first,baseline_last,synonym_similarity,hypernym_similarity,hyponym_similarity,most_common_def_similarity,less_common_def_similarity,f0_synset_frequency,f1_overlapping_words,f2_synset_and_context_after,f3_synset_and_context_before,f4_synset_and_target_similarity,f5_target_and_synset_definition,f6_synset_and_sentence_similarity,f7_target_word_and_sentence_similarity,f8_synset_example_and_sentence_similarity,f9_synset_definition_and_sentence_similarity,f10_lesk_pred_and_target_similarity,model_pred
36771,brown1/tagfiles/br-j03.xml_19,9,was,be.v.03,The actual pressure was not determined because the pressure,beyond the upper limit of the apparatus on hand .,True,The actual pressure was not determined because the pressure was beyond the upper limit of the apparatus on hand .,113,VBD,be.v.10,be.v.01,cost.v.01,0.09773031596011622,0.12053670927140471,0.06407910869141639,0.2502330224233164,0.3206786856408494,3,0,0.2941860208139299,0.43996078841739844,0.4430121860417598,0.2588205588860009,0.42870330089736275,0.4998549545132966,0.7036926842906652,0.6748792981843817,0.08215221952380607,False
44283,brown1/tagfiles/br-j09.xml_42,18,was,be.v.03,Each initially contained 1700 ml of buffer ; in the sphere was starting buffer and in the cone,"final buffer , 0.50 M in both * * f and Tris , pH 4.1 .",True,"Each initially contained 1700 ml of buffer ; in the sphere was starting buffer and in the cone was final buffer , 0.50 M in both * * f and Tris , pH 4.1 .",154,VBD,embody.v.02,be.v.01,cost.v.01,0.09773031596011622,0.12053670927140471,0.06407910869141639,0.2502330224233164,0.3206786856408494,3,0,0.15494562827322028,0.3618600285050147,0.4430121860417598,0.2588205588860009,0.27872107212694625,0.31623921587013537,0.6999945274090633,0.765600106096565,0.08215221952380607,False
30711,brown1/tagfiles/br-g01.xml_57,3,been,be.v.05,Southern resentment has,"over the method of its ending , the invasion , and Reconstruction ; their fears now are of miscegenation and Negro political control in many counties .",True,"Southern resentment has been over the method of its ending , the invasion , and Reconstruction ; their fears now are of miscegenation and Negro political control in many counties .",180,VBN,be.v.08,be.v.02,cost.v.01,0.11386357387652979,0.13712509033967263,0.07300407054079977,0.25400060826763377,0.30046793443817216,4,0,0.3056072515486651,0.221271841314418,0.4894915509540331,0.11968712641456972,0.34071758684368403,0.3940182154470394,0.6713206871565677,0.7346190545043396,0.4894915509540331,False
32076,brown1/tagfiles/br-g11.xml_70,6,been,be.v.05,"In the life sciences , there has","an enormous increase in our understanding of disease , in the mechanisms of heredity , and in bio - and physiological chemistry .",True,"In the life sciences , there has been an enormous increase in our understanding of disease , in the mechanisms of heredity , and in bio - and physiological chemistry .",167,VBN,embody.v.02,be.v.02,cost.v.01,0.11386357387652979,0.13712509033967263,0.07300407054079977,0.25400060826763377,0.30046793443817216,4,0,0.23181814460625,0.34860459053061343,0.4894915509540331,0.11968712641456972,0.3015590595743946,0.32579062505969897,0.6911558016908295,0.7422601785045058,0.4894915509540331,False
33255,brown1/tagfiles/br-g15.xml_66,48,be,be.v.05,"In method as well as in theme this little anecdote with its details selected as much for expressiveness and allegory as for `` realism '' , anticipates a kind of musical composition , as well as a kind of fictional composition , in which , as Leverku^hn says , `` there shall",nothing unthematic '' .,True,"In method as well as in theme this little anecdote with its details selected as much for expressiveness and allegory as for `` realism '' , anticipates a kind of musical composition , as well as a kind of fictional composition , in which , as Leverku^hn says , `` there shall be nothing unthematic '' .",302,VB,be.v.03,be.v.01,cost.v.01,0.24380535016378205,0.24625759181842005,0.1477422032054047,0.1565233405447265,0.6764124644736985,5,0,0.1358048837512399,0.3583081235547561,1.0,0.26633728216334346,0.3743335283491537,0.3743335283491537,0.6545154466466852,0.7299180505002469,0.13145889545148326,False
3564,brown1/tagfiles/br-a12.xml_31,11,was,be.v.05,Saxton has made only one second-half appearance this season and that,"in the Washington State game , for four plays : he returned the kickoff 30 yards , gained five yards through the line and then uncorked a 56 - yard touchdown run before retiring to the bench .",True,"Saxton has made only one second-half appearance this season and that was in the Washington State game , for four plays : he returned the kickoff 30 yards , gained five yards through the line and then uncorked a 56 - yard touchdown run before retiring to the bench .",265,VBD,be.v.11,be.v.01,cost.v.01,0.09773031596011622,0.12053670927140471,0.06407910869141639,0.2502330224233164,0.3206786856408494,5,0,0.29600208577218734,0.3709052932891179,0.4430121860417598,0.13800723853724678,0.34033576331401344,0.4023153964169182,0.7293583805277657,0.7244864071498467,0.08215221952380607,False
41487,brown1/tagfiles/br-j07.xml_10,2,is,be.v.05,Since there,"a continual loss of micrometeoritic material in space because of the radiation effects , there must be a continual replenishment : otherwise , micrometeorites would have disappeared from interplanetary space .",True,"Since there is a continual loss of micrometeoritic material in space because of the radiation effects , there must be a continual replenishment : otherwise , micrometeorites would have disappeared from interplanetary space .",224,VBZ,be.v.11,be.v.02,cost.v.01,0.18642668614271674,0.17128911233676034,0.10161850513977112,0.28594981639126377,0.39444203433257213,4,0,0.4026613602619789,0.27419214570129824,0.4719899211581473,0.18981254412926454,0.43179620756914977,0.38673623432966375,0.6884791519636634,0.7376286724711034,0.4719899211581473,False
43107,brown1/tagfiles/br-j08.xml_50,1,was,be.v.05,There,"a slight lapse condition , a moderate fog , and 100 per cent relative humidity .",True,"There was a slight lapse condition , a moderate fog , and 100 per cent relative humidity .",90,VBD,washington.n.02,be.v.01,cost.v.01,0.09773031596011622,0.12053670927140471,0.06407910869141639,0.2502330224233164,0.3206786856408494,5,0,0.1617610926315826,0.22723884595177865,0.4430121860417598,0.13800723853724678,0.22343133549395133,0.27485351514078693,0.5782839144455764,0.7594098562306052,0.08215221952380607,False
34362,brown1/tagfiles/br-h01.xml_77,6,is,be.v.05,"If nothing is produced , there",no obligation to repay .,True,"If nothing is produced , there is no obligation to repay .",58,VBZ,be.v.03,be.v.02,cost.v.01,0.18642668614271674,0.17128911233676034,0.10161850513977112,0.28594981639126377,0.39444203433257213,4,0,0.19373226890280099,0.43412792025301017,0.4719899211581473,0.18981254412926454,0.40525125870456186,0.5405390080758755,0.6066317578071767,0.6610239389940444,0.11533033457256235,False
14076,brown1/tagfiles/br-d01.xml_73,2,is,be.v.05,For it,primarily in community that we know and experience spirit .,True,For it is primarily in community that we know and experience spirit .,69,VBZ,be.v.03,be.v.02,cost.v.01,0.18642668614271674,0.17128911233676034,0.10161850513977112,0.28594981639126377,0.39444203433257213,4,0,0.364215061421322,0.4428723571144818,0.4719899211581473,0.18981254412926454,0.46329653294870277,0.5185901482705184,0.7451211021045702,0.5942615633607536,0.4719899211581473,False
44676,brown1/tagfiles/br-j09.xml_73,3,be,be.v.05,There appeared to,"no difference in the distribution of anti - A and anti - B activity in group O serum , though in two group O donors ( J. F. and E. M. ) only one type of agglutinin was found in the regions of low anionic binding capacity ( Figs. 1 and 2 ) .",True,"There appeared to be no difference in the distribution of anti - A and anti - B activity in group O serum , though in two group O donors ( J. F. and E. M. ) only one type of agglutinin was found in the regions of low anionic binding capacity ( Figs. 1 and 2 ) .",261,VB,be.v.10,be.v.01,cost.v.01,0.24380535016378205,0.24625759181842005,0.1477422032054047,0.1565233405447265,0.6764124644736985,5,0,0.26316392864093197,0.24817395454948016,1.0,0.26633728216334346,0.2995654749012576,0.2995654749012576,0.6479408919385636,0.788151887961958,1.0,False
29847,brown1/tagfiles/br-f43.xml_77,5,been,be.v.05,Not that there had not,"attempts , mostly European , to do exactly that .",True,"Not that there had not been attempts , mostly European , to do exactly that .",77,VBN,be.v.08,be.v.02,cost.v.01,0.11386357387652979,0.13712509033967263,0.07300407054079977,0.25400060826763377,0.30046793443817216,4,0,0.22387297538228104,0.4582359108355049,0.4894915509540331,0.11968712641456972,0.39456139606942486,0.4085230940129396,0.6747370271968235,0.6964333411455298,0.0036884277520906517,False
34908,brown1/tagfiles/br-j01.xml_28,2,been,be.v.05,There have,few measurements specifically for the determination of the polarization of planetary radiation .,True,There have been few measurements specifically for the determination of the polarization of planetary radiation .,112,VBN,be.v.11,be.v.02,cost.v.01,0.11386357387652979,0.13712509033967263,0.07300407054079977,0.25400060826763377,0.30046793443817216,4,0,0.3033293336054383,0.4517480528493343,0.4894915509540331,0.11968712641456972,0.41842956824056327,0.442762165962046,0.6993029930878918,0.6535279540378198,0.4894915509540331,False
15660,brown1/tagfiles/br-d03.xml_27,21,was,be.v.05,"A Catholic priest recently recounted how in the chapel of a large city university , following Anglican evensong , at which there","a congregation of twelve , he celebrated Mass before more than a hundred .",True,"A Catholic priest recently recounted how in the chapel of a large city university , following Anglican evensong , at which there was a congregation of twelve , he celebrated Mass before more than a hundred .",207,VBD,equal.v.01,be.v.01,cost.v.01,0.09773031596011622,0.12053670927140471,0.06407910869141639,0.2502330224233164,0.3206786856408494,5,0,0.2727726950888803,0.2917325158759477,0.4430121860417598,0.13800723853724678,0.3173883831808406,0.33015907156273316,0.6845941754467267,0.7590162400666527,0.08215221952380607,False
41034,brown1/tagfiles/br-j06.xml_60,4,was,be.v.05,In all cases there,readily measurable exchange after as little as one hour of illumination .,True,In all cases there was readily measurable exchange after as little as one hour of illumination .,96,VBD,washington.n.02,be.v.01,cost.v.01,0.09773031596011622,0.12053670927140471,0.06407910869141639,0.2502330224233164,0.3206786856408494,5,0,0.37989148783816185,0.33356400199630476,0.4430121860417598,0.13800723853724678,0.4520882269828591,0.43885127394140955,0.6778303441279574,0.5313519920032891,-0.005385486557501407,False
3474,brown1/tagfiles/br-a12.xml_26,19,gets,become.v.01,"`` It 's kind of like golf - if you do n't swing a club very often , your timing",off '' .,True,"`` It 's kind of like golf - if you do n't swing a club very often , your timing gets off '' .",94,VBZ,scram.v.01,get.v.01,beget.v.01,0.12207320727986253,0.1011026447952148,0.09463582685435812,0.26591234560032156,0.20942203958508945,2,1,0.014083161810297751,0.1861136864758052,0.24195908270905983,0.25299810215550533,0.17705206335979612,0.3379898293557088,0.4933599312998901,0.6269230664252153,0.16518450538912194,False
29328,brown1/tagfiles/br-f43.xml_43,9,became,become.v.02,One reel - from eight to twelve minutes -,"the standard length from the year of Robbery , 1903 , until Griffith shattered that limit forever with Birth of a Nation in 1915 .",True,"One reel - from eight to twelve minutes - became the standard length from the year of Robbery , 1903 , until Griffith shattered that limit forever with Birth of a Nation in 1915 .",179,VBD,become.v.04,become.v.02,become.v.04,0.22507319522191382,0.01733699683662838,0.04212945199994357,0.13015480265409168,0.14927257298716823,1,1,0.14369232911063884,0.09188814868545155,0.7126693538842225,0.1010262066307788,0.17707856872338423,0.1852093632874155,0.3858846766894437,0.6099434635420933,0.7126693538842225,False
345,brown1/tagfiles/br-a01.xml_39,8,became,become.v.02,"He will be succeeded by Ivan Allen Jr. , who",a candidate in the Sept. 13 primary after Mayor Hartsfield announced that he would not run for reelection .,True,"He will be succeeded by Ivan Allen Jr. , who became a candidate in the Sept. 13 primary after Mayor Hartsfield announced that he would not run for reelection .",159,VBD,become.v.04,become.v.02,become.v.04,0.22507319522191382,0.01733699683662838,0.04212945199994357,0.13015480265409168,0.14927257298716823,1,1,0.22219412216146622,0.20480947759023432,0.7126693538842225,0.1010262066307788,0.27029223511362954,0.2666944868299435,0.3836171628764734,0.6228881197986837,0.7126693538842225,False
36307,brown1/tagfiles/br-j02.xml_89,23,indicated,bespeak.v.01,Simultaneously with the anode surface temperature and voltage measurements pyrometer readings were taken along the cylindrical surface of the carbon anode holder as,on figure 2 .,False,Simultaneously with the anode surface temperature and voltage measurements pyrometer readings were taken along the cylindrical surface of the carbon anode holder as indicated on figure 2 .,188,VBN,argue.v.03,indicate.v.02,indicate.v.05,0.3198064786005881,0.20510293148537806,0.13721121615883627,0.24703242016926,0.28577751289786374,0,1,0.1035683121461189,0.1856004364022056,0.16510162865516265,0.24703242016926,0.19591401209372433,0.3119102497445413,0.47674875274504325,0.5928917197465915,0.7437695056780762,True
411,brown1/tagfiles/br-a01.xml_43,19,take,bring.v.01,"In the Blue Ridge meeting , the audience was warned that entering a candidate for governor would force it to",petitions out into voting precincts to obtain the signatures of registered voters .,True,"In the Blue Ridge meeting , the audience was warned that entering a candidate for governor would force it to take petitions out into voting precincts to obtain the signatures of registered voters .",197,VB,return.n.06,take.n.02,contract.v.04,0.20691458249165023,0.15860694774597645,0.09923113411968289,0.2195727634331204,0.20272917136260607,8,1,0.16338997436485658,0.23420378754396032,0.44615721584124207,0.45069422598370995,0.2496270794382923,0.3189638619705156,0.6515531960807237,0.5410289256824453,0.9999999999999999,False
21654,brown1/tagfiles/br-e21.xml_23,23,develop,build_up.v.05,The same is true of areas which at first look good because of a few existing recreation features but may actually be poor areas to,for general public use .,True,The same is true of areas which at first look good because of a few existing recreation features but may actually be poor areas to develop for general public use .,163,VB,evolve.v.01,evolve.v.01,develop.v.21,0.28000835651142125,0.16795416975975538,0.09810946903900708,0.2607850863807403,0.2889989875680372,5,2,0.4379109038955899,0.5134066828949512,-0.016998693787008544,0.30875081783444563,0.517981638531598,0.3179433569957756,0.3631926084107069,0.8017387902329065,0.4940462752108567,False
9336,brown1/tagfiles/br-b20.xml_59,6,buried,bury.v.02,"There is Karl Marx , of course ,",in London .,True,"There is Karl Marx , of course , buried in London .",51,VBN,bury.v.03,bury.v.02,buried.a.01,0.2059896078671822,0.06900286310387249,0.04558127620597261,0.15236517094122706,0.38492897853451813,1,1,0.07049814765968401,0.05490841833520748,0.7147597625603382,0.36820517558004584,0.1506332053408519,0.15766429227099163,0.67239097634236,0.567568378674973,0.7147597625603382,False
48282,brown1/tagfiles/br-j13.xml_10,4,called,call.v.02,Such classifications may be,"`` somewhat advanced '' or `` somewhat delayed '' , as the case may be , reserving `` moderate '' for dots upon or close to the mean .",True,"Such classifications may be called `` somewhat advanced '' or `` somewhat delayed '' , as the case may be , reserving `` moderate '' for dots upon or close to the mean .",169,VBN,call.v.05,call.v.02,call.v.28,0.09580622632976915,0.08285707098272779,0.05666985838717066,0.09291310257431654,0.26916247854595693,1,2,0.21060626875123337,0.17348920556053535,0.461285808793528,0.12310313938366038,0.24291206401975823,0.22933153506304796,0.5622854968539048,0.8617372165020181,0.461285808793528,False
41457,brown1/tagfiles/br-j07.xml_7,38,captured,capture.v.04,"If such is the case , the particles within a distance of about * * f km of the Earth will have , relative to the Earth , a kinetic energy less than their potential energy and they will be",into orbits about the Earth .,True,"If such is the case , the particles within a distance of about * * f km of the Earth will have , relative to the Earth , a kinetic energy less than their potential energy and they will be captured into orbits about the Earth .",226,VBN,capture.v.06,capture.v.02,capture.v.06,0.0833147398947399,0.08242195700494584,0.057560389525768106,0.18205587644514917,0.18026093377455318,3,5,0.1468499814638596,0.08073964292409261,0.7155307758586958,0.18184235629870965,0.12596274354300524,0.09681374867215939,0.8185886795861682,0.8478680607372397,0.7155307758586958,False
19686,brown1/tagfiles/br-e02.xml_75,4,cared,care.v.02,If the plants are,"for and protected over the winter , the second year is more prolific than the first .",True,"If the plants are cared for and protected over the winter , the second year is more prolific than the first .",109,VBN,wish.v.02,care.v.02,worry.v.02,0.22775350958359025,0.14444775241455204,0.10476766046259542,0.3190457197457095,0.2868286732010689,1,1,0.18553004310719562,0.2622381765784707,0.5646680818875536,0.35738617271304446,0.26665699594640824,0.2721704881929385,0.7378256673295224,0.48650336404014527,0.5646680818875536,False
27891,brown1/tagfiles/br-f19.xml_33,49,carrying,carry.v.04,"Nor have we remembered that in the melting pot of America the hundreds of isolated and semi isolated ethnic , regional and occupational groups did not fuse into a homogeneous national unit until long after education and industrialization had caused them to cast oral tradition aside as a means of",culturally significant material .,True,"Nor have we remembered that in the melting pot of America the hundreds of isolated and semi isolated ethnic , regional and occupational groups did not fuse into a homogeneous national unit until long after education and industrialization had caused them to cast oral tradition aside as a means of carrying culturally significant material .",339,VBG,carry.v.12,carry.v.02,have_a_bun_in_the_oven.v.01,0.14351938411373638,0.10005231701101623,0.136211189058032,0.20616896499736698,0.2676376263879457,3,3,0.1267617753144033,0.2441795919394714,0.6818654368209851,0.19032258878825573,0.26699560477238304,0.23115432487522686,0.7465649277947145,0.685774505484533,0.6818654368209851,False
26256,brown1/tagfiles/br-f03.xml_61,21,fulfilled,carry_through.v.01,"The degree of circumstance , the ratio of memory to forgetfulness , determines whether a dream will be a recognized ,","prevision , or the vaguely , effective source of the weird deja vu feeling .",True,"The degree of circumstance , the ratio of memory to forgetfulness , determines whether a dream will be a recognized , fulfilled prevision , or the vaguely , effective source of the weird deja vu feeling .",204,VBN,satisfy.v.01,meet.v.04,fulfilled.s.01,0.28031381669481154,0.1479790465697151,0.11504787110189507,0.11547700911144125,0.3104879243937874,0,0,0.7881112707672377,0.8509944013871363,-0.02312230175407091,0.11547700911144125,0.8419380911496285,0.15541947689644958,0.6152614352540929,0.337947392544361,0.49438623429401307,False
10053,brown1/tagfiles/br-c01.xml_37,21,made,cause.v.01,A couple of days later a balletomane told me he had telephoned Allied Arts for ticket information and was told `` the newspapers had,a mistake '' .,True,A couple of days later a balletomane told me he had telephoned Allied Arts for ticket information and was told `` the newspapers had made a mistake '' .,152,VBN,made.s.01,make.v.02,made.s.03,0.13009964218207648,0.11703058273516692,0.10451405334079683,0.17597501507888996,0.18168201704317577,4,0,0.092229665589751,0.1844736268392842,0.1069360552442002,0.25116660061243384,0.17831736948584223,0.3562069813166416,0.6035782222237283,0.7601790024303011,0.7246420764479289,False
34083,brown1/tagfiles/br-h01.xml_53,6,make,cause.v.01,The maximum loan which SBA may,to any one borrower is $ 350000 .,True,The maximum loan which SBA may make to any one borrower is $ 350000 .,69,VB,brand.n.02,shuffle.n.01,make.v.49,0.2008609841717637,0.22886484876178495,0.16696423421055445,0.26406540048252963,0.22447328469666636,6,1,0.16151074041423105,0.2182544711607467,0.19859175421631742,0.41129003887833626,0.21767188410953778,0.3887260013074805,0.5568542921227183,0.8067601980263193,1.0000000000000002,False
20300,brown1/tagfiles/br-e04.xml_15,13,reflected,chew_over.v.01,But the most impressive testimony to Schnabel 's distinction as a teacher is,by the individuality which marks each student 's approach as distinctly his own .,False,But the most impressive testimony to Schnabel 's distinction as a teacher is reflected by the individuality which marks each student 's approach as distinctly his own .,168,VBN,reflected.a.01,chew_over.v.01,reflected.a.01,0.21160469709112492,0.15919498965687653,0.09600609740533875,0.2919931917451816,0.16044076506740404,1,1,0.47980185981888174,0.7521722129911788,0.10488185712926608,0.5193609935854813,0.6516690022481056,0.34042499342631927,0.7751768828187438,0.6874457512307771,0.7501716526331239,True
8316,brown1/tagfiles/br-b13.xml_87,28,reflects,chew_over.v.01,"In an effort to fortify himself against the unforeseen upsets sure to arise in the future , Herbert A. Leggett , banker editor of the Phoenix `` Arizona Progress '' ,",upon a few of the depressing experiences of the feverish fifties .,True,"In an effort to fortify himself against the unforeseen upsets sure to arise in the future , Herbert A. Leggett , banker editor of the Phoenix `` Arizona Progress '' , reflects upon a few of the depressing experiences of the feverish fifties .",242,VBZ,reflect.v.07,chew_over.v.01,reflect.v.07,0.15817277257984033,0.14500854757358717,0.10065952090796196,0.2519556135576291,0.21932092097681571,1,1,0.744297025952803,0.8622310554672599,0.12308134318840941,0.46022241183275897,0.8474909077014262,0.2636289294453408,0.8189417820338353,0.6645969519715462,0.6908377380574892,False
22629,brown1/tagfiles/br-e21.xml_95,17,cleared,clear.v.05,"Some shrubs may be of good landscaping value , other areas of brush may need to be",.,True,"Some shrubs may be of good landscaping value , other areas of brush may need to be cleared .",92,VBN,gain.v.08,clear.v.02,absolved.s.01,0.13609678428930563,0.11940810529295456,0.10535705876505783,0.20455695265310772,0.26908847434763167,4,0,0.06281912040156971,0.2054815886976595,0.3563043056973793,0.3561969391478851,0.23102102481840323,0.2672279231788081,0.4418043730933468,0.237487335332163,1.0,False
44292,brown1/tagfiles/br-j09.xml_43,14,collected,collect.v.04,A flow rate of 72 * * f was used and 12 ml fractions were,.,True,A flow rate of 72 * * f was used and 12 ml fractions were collected .,69,VBN,gather.v.01,collect.v.02,collected.s.02,0.16733885685367295,0.126705488024038,0.09117599324708653,0.2666898267840968,0.024481409701071735,3,0,-0.05768117164815165,0.04212394231211607,0.6879931319398123,0.17320565730766702,0.10362535881079994,0.20072897018600352,0.32776416813559006,0.15928408397106758,0.6879931319398123,False
6576,brown1/tagfiles/br-a15.xml_28,5,came,come.v.01,"Despite the recession , Pittsburgh","into town with this imposing list of averages : Smoky Burgess .455 , Gino Cimoli .389 , Bill Virdon .340 , Bob Clemente and Dick Groat , each .323 , Dick Stuart .306 , Don Hoak .280 and Bob Skinner .267 .",True,"Despite the recession , Pittsburgh came into town with this imposing list of averages : Smoky Burgess .455 , Gino Cimoli .389 , Bill Virdon .340 , Bob Clemente and Dick Groat , each .323 , Dick Stuart .306 , Don Hoak .280 and Bob Skinner .267 .",244,VBD,come.v.05,arrive.v.01,come.v.21,0.15161885085572957,0.13378799036019448,0.08048870828368518,0.18234685097489972,0.07672035617270753,0,0,0.09119302093785772,0.19961166524546475,0.6120335414078512,0.18234685097489972,0.11963267882000209,0.1045345338160237,0.17495460909279034,0.4236607146332892,0.2527996576137092,False
39819,brown1/tagfiles/br-j05.xml_61,19,come,come.v.01,"( 3 ) For anionics , these micelles appear to be roughly spherical assemblages in which the hydrocarbon tails",together so that the polar groups ( the ionized ends ) face outward towards the aqueous continuous phase .,True,"( 3 ) For anionics , these micelles appear to be roughly spherical assemblages in which the hydrocarbon tails come together so that the polar groups ( the ionized ends ) face outward towards the aqueous continuous phase .",221,VB,do.v.04,come.v.01,come.v.21,0.21338343785679204,0.2420412452680198,0.12850440259973947,0.2111270065425153,0.27473622630395933,1,0,0.3206457174854061,0.2628569304156133,0.9999999999999998,0.3996853206995526,0.35867833431076007,0.35867833431076007,0.5115899163919521,0.6141655397913833,0.9999999999999998,False
