,sentence_id,target_index,target_word,synset,context_before,context_after,synset_is_correct,full_sentence,len_sentence,target_word_pos,baseline_random,baseline_first,baseline_last,synonym_similarity,hypernym_similarity,hyponym_similarity,most_common_def_similarity,less_common_def_similarity,f0_synset_frequency,f1_overlapping_words,f2_synset_and_context_after,f3_synset_and_context_before,f4_synset_and_target_similarity,f5_target_and_synset_definition,f6_synset_and_sentence_similarity,f7_target_word_and_sentence_similarity,f8_synset_example_and_sentence_similarity,f9_synset_definition_and_sentence_similarity,f10_lesk_pred_and_target_similarity,model_pred
36990,brown1/tagfiles/br-j03.xml_34,15,opposed,oppose.v.03,Consider a shear field with a height of H and a cross-sectional area of A,by a manometer with a height of h ( referred to the same base as H ) and a cross-sectional area of a .,True,Consider a shear field with a height of H and a cross-sectional area of A opposed by a manometer with a height of h ( referred to the same base as H ) and a cross-sectional area of a .,184,VBN,oppose.v.06,fight.v.02,opposed.a.01,0.2651895599202173,0.168170516540542,0.15128617042806286,0.271381803208882,0.23113759884169255,2,1,0.16056616333978135,0.1950547143250341,0.7894548069744667,0.2096461627310875,0.20849798761096738,0.23357644103559316,0.9270281331050682,0.39898918815949647,0.1882074306521381,False
42491,brown1/tagfiles/br-j07.xml_82,14,magnified,overstate.v.01,The observational data determining the concentration distribution have a range of error which is,in the extension into the micrometeorite region .,False,The observational data determining the concentration distribution have a range of error which is magnified in the extension into the micrometeorite region .,156,VBN,blow_up.v.02,overstate.v.01,exaggerated.s.02,0.2753953011268015,0.13972307694593947,0.11051061896695993,0.321436488080171,0.2827110868819716,1,1,0.28139822538235537,0.5442248409953133,0.11022541957767618,0.3030707035543901,0.46776931627326346,0.38213118407128077,0.5920289842380259,0.7328186264057803,0.11022541957767618,True
9960,brown1/tagfiles/br-c01.xml_23,4,have,own.v.01,"Well , now we",two big theaters .,True,"Well , now we have two big theaters .",37,VB,suffer.v.02,have.v.01,take.v.35,0.22225699163046142,0.15268625752582207,0.1425637831621209,0.2976118735013364,0.5473088497853392,4,1,0.20542555347561703,0.28856314412278117,0.23840700007184004,0.5909189996974082,0.30860914609305173,0.6111402866072911,0.6667434092943226,0.6130198980957059,0.324748590217239,False
12114,brown1/tagfiles/br-c04.xml_31,19,has,own.v.01,"There is a fine second act , as an example , one in which Samuel Groom , as Dillon ,",an opportunity to blaze away in one impassioned passage after another .,True,"There is a fine second act , as an example , one in which Samuel Groom , as Dillon , has an opportunity to blaze away in one impassioned passage after another .",160,VBZ,have.v.10,have.v.01,take.v.35,0.07300858302795371,0.05856038595405621,0.04221766750056804,0.22191392999106513,0.27238063666698226,4,0,0.28645917217067207,0.2366125627168993,0.14254547870404313,0.3090855274135834,0.2741003582672682,0.3294848014212785,0.6733189658870874,0.6317102281854654,-0.018570383020494574,False
867,brown1/tagfiles/br-a01.xml_70,33,passed,pass.v.09,"Barber , who is in his 13th year as a legislator , said there `` are some members of our congressional delegation in Washington who would like to see it ( the resolution )",'' .,True,"Barber , who is in his 13th year as a legislator , said there `` are some members of our congressional delegation in Washington who would like to see it ( the resolution ) passed '' .",183,VBN,pass.v.09,travel_by.v.01,excrete.v.01,0.08468910467434404,0.08809641838144858,0.06352164204636274,0.21539459492327495,0.27641961403519244,8,0,0.022817507094398674,0.18446126942184526,0.549949833275471,0.3465483390624211,0.20028028506536946,0.24839281146193792,0.5252101503902783,0.6880041538864431,0.09574599329005415,False
1689,brown1/tagfiles/br-a02.xml_53,7,passed,pass.v.09,"When the shouting ended , the bill",", 114 to 4 , sending it to the Senate , where a similar proposal is being sponsored by Sen. George Parkhouse of Dallas .",True,"When the shouting ended , the bill passed , 114 to 4 , sending it to the Senate , where a similar proposal is being sponsored by Sen. George Parkhouse of Dallas .",162,VBN,pass.v.07,travel_by.v.01,excrete.v.01,0.08468910467434404,0.08809641838144858,0.06352164204636274,0.21539459492327495,0.27641961403519244,8,0,0.11681412180670867,0.2529034985091979,0.549949833275471,0.3465483390624211,0.18425745054680967,0.2508480378602751,0.4906147705321404,0.6826500670746755,0.549949833275471,False
6870,brown1/tagfiles/br-a15.xml_54,24,get,pay_back.v.02,"We 'd be losing at halftime to a good team and Hartweger would say , ' Do n't worry , Coach - we 'll",'em all right '' ' .,True,"We 'd be losing at halftime to a good team and Hartweger would say , ' Do n't worry , Coach - we 'll get 'em all right '' ' .",125,VB,bring.v.04,get.v.01,beget.v.01,0.21756989903442617,0.1796043039271046,0.16174000963690255,0.37344205776605954,0.4043051450535392,8,1,0.932527869690362,0.8701413283192844,0.019062401666897953,0.6836602415028045,0.8881937314902754,0.3143717190577108,0.7487075039177897,0.42611696632832213,1.0,False
33261,brown1/tagfiles/br-g15.xml_67,10,did,perform.v.01,"It resembles , too , pictures such as Du^rer and Bruegel",", in which all that looks at first to be solely pictorial proves on inspection to be also literary , the representation of a proverb , for example , or a deadly sin .",True,"It resembles , too , pictures such as Du^rer and Bruegel did , in which all that looks at first to be solely pictorial proves on inspection to be also literary , the representation of a proverb , for example , or a deadly sin .",227,VBD,practice.v.01,perform.v.01,do.v.13,0.16649983128199128,0.10915845461583903,0.08884695489984866,0.1876190340506494,0.14376573941716758,1,1,0.12890353637472357,0.08272674548234053,0.13058335158179046,0.3146887565250954,0.12308941990176185,0.30793193346817355,0.8120612349541909,0.47501278398115915,0.16124876923383982,False
49135,brown1/tagfiles/br-j13.xml_60,3,depicted,picture.v.02,The growth center,"here , in the distal phalanx of the second finger , is listed as the fifth of those in the seven short bones .",False,"The growth center depicted here , in the distal phalanx of the second finger , is listed as the fifth of those in the seven short bones .",137,VBN,describe.v.01,describe.v.01,depicted.s.01,0.44801095694006837,0.14425140586743118,0.22587092028490216,0.255516899958164,0.37184232702744646,0,1,0.2273689763926503,0.1611926413372272,0.35591991718580157,0.255516899958164,0.253152863263687,0.28320214817015676,0.629779173009208,0.671225914420842,0.6350999450396146,True
6465,brown1/tagfiles/br-a15.xml_13,20,playing,play.v.01,"Harvey Haddix , set back by the flu this season , will start against his former Cardinal mates , who might be",without captain Kenny Boyer in tonight 's game at Busch Stadium .,True,"Harvey Haddix , set back by the flu this season , will start against his former Cardinal mates , who might be playing without captain Kenny Boyer in tonight 's game at Busch Stadium .",183,VBG,play.v.06,playing.n.02,play.v.35,0.1919196600846467,0.14691397110754867,0.0993855101838303,0.4489122473829318,0.15339637685068194,3,1,0.325057389394832,0.32630084303973733,0.7668500749593593,0.44663381274593045,0.3831735152535059,0.3564286114827523,0.4979307739181787,0.4928907049875464,0.7668500749593593,False
4725,brown1/tagfiles/br-a13.xml_36,9,playing,play.v.01,Boston Red Sox Outfielder Jackie Jensen said Monday night he was through,baseball .,True,Boston Red Sox Outfielder Jackie Jensen said Monday night he was through playing baseball .,91,VBG,acting.n.01,playing.n.02,play.v.35,0.1919196600846467,0.14691397110754867,0.0993855101838303,0.4489122473829318,0.15339637685068194,3,0,0.21001730453669304,0.21278743309129214,0.7668500749593593,0.44663381274593045,0.3152128456835378,0.311660513136448,0.4465790499419377,0.3558324512274009,1.0000000000000002,False
9750,brown1/tagfiles/br-c01.xml_1,24,playing,play.v.06,"Certainly not in Orchestra hall where he has played countless recitals , and where Thursday night he celebrated his 20th season with the Chicago Symphony orchestra ,","the Brahms Concerto with his own slashing , demon-ridden cadenza melting into the high , pale , pure and lovely song with which a violinist unlocks the heart of the music , or forever finds it closed .",True,"Certainly not in Orchestra hall where he has played countless recitals , and where Thursday night he celebrated his 20th season with the Chicago Symphony orchestra , playing the Brahms Concerto with his own slashing , demon-ridden cadenza melting into the high , pale , pure and lovely song with which a violinist unlocks the heart of the music , or forever finds it closed .",375,VBG,act.v.05,playing.n.02,play.v.35,0.1919196600846467,0.14691397110754867,0.0993855101838303,0.4489122473829318,0.15339637685068194,8,1,0.24668539163757655,0.386519944977886,0.7668500749593593,0.00867403876366984,0.3418631786136715,0.3439345510778014,0.788280307010825,0.6387409954500192,1.0000000000000002,False
25579,brown1/tagfiles/br-f03.xml_18,13,lived,populate.v.01,"I recall the startling , vivid realism of a dream in which I",through the horror of the bombing of a little Korean town .,False,"I recall the startling , vivid realism of a dream in which I lived through the horror of the bombing of a little Korean town .",126,VBD,populate.v.01,live.v.02,live.v.07,0.20263765541467477,0.09534379132480844,0.08700232161358921,0.24014923328213644,0.156168484778902,0,1,0.1281233684461491,0.14806844266961858,0.17594020872800065,0.24014923328213644,0.15801849632545636,0.22506323598126143,0.6951761111711823,0.781899697050822,0.4977888228884369,True
2673,brown1/tagfiles/br-a11.xml_44,8,posted,post.v.05,"Ryne Duren and Roland Sheldon , a rookie righthander who","a 15 - 1 record last year for the Yanks ' Auburn ( N.Y. ) farm club of the Class - D New York-Pennsylvania League , are the probable rival pitchers .",True,"Ryne Duren and Roland Sheldon , a rookie righthander who posted a 15 - 1 record last year for the Yanks ' Auburn ( N.Y. ) farm club of the Class - D New York-Pennsylvania League , are the probable rival pitchers .",213,VBN,post.v.05,post.v.02,posted.a.01,0.1996034044717454,0.07068030482719419,0.08404945544396475,0.23729907018615495,0.19389901317966043,4,1,0.21853530910724062,0.12659400919953992,0.35915201796055396,0.15091992996171583,0.20883398752071308,0.14067325148264523,0.9218736947962364,0.7736932054836271,0.35915201796055396,False
31371,brown1/tagfiles/br-g11.xml_17,20,follow,postdate.v.01,"Just as present technology had to await the explanations of physics , so one might expect that social invention will",growing sociological understanding .,True,"Just as present technology had to await the explanations of physics , so one might expect that social invention will follow growing sociological understanding .",160,VB,follow.v.06,postdate.v.01,stick_to.v.02,0.20905195871668109,0.18685952114237592,0.1467889678027383,0.3527597463780675,0.24913636354472168,1,0,0.6230607561256701,0.48412144004462176,0.09826447061536052,0.27794515218927957,0.5485312806118672,0.36746425694926277,0.6827704723160547,0.5671809755053452,1.0,False
19086,brown1/tagfiles/br-e02.xml_18,29,followed,postdate.v.01,"It does n't really matter which month of the year you sow them , but they germinate best when they have a wide variation of temperature , very warm",by cool in the same 24 hours .,True,"It does n't really matter which month of the year you sow them , but they germinate best when they have a wide variation of temperature , very warm followed by cool in the same 24 hours .",187,VBD,follow.v.06,postdate.v.01,stick_to.v.02,0.10694442965947346,0.07040292488255089,0.07723343236819771,0.2497309625305537,0.0680961413326173,1,1,0.5536771812337865,0.5751017749059988,0.06250710819315473,0.2565078998570551,0.5911203646919937,0.21518796942622112,0.6978742588979042,0.636396896446162,0.051281602352647775,False
40284,brown1/tagfiles/br-j06.xml_10,16,followed,postdate.v.01,It should be possible to free carbon tetrachloride of any interfering substances by the usual purification methods,by prechlorination prior to addition of radioactive chlorine .,True,It should be possible to free carbon tetrachloride of any interfering substances by the usual purification methods followed by prechlorination prior to addition of radioactive chlorine .,186,VBD,adopt.v.01,postdate.v.01,stick_to.v.02,0.10694442965947346,0.07040292488255089,0.07723343236819771,0.2497309625305537,0.0680961413326173,1,1,0.8530668909748947,0.46742712107695894,0.06250710819315473,0.2565078998570551,0.6756706509794969,0.26528346745456605,0.7121976328897741,0.507305181082114,0.2535688094105358,False
23703,brown1/tagfiles/br-e24.xml_79,6,followed,postdate.v.01,"The right will land first ,",by the left .,True,"The right will land first , followed by the left .",50,VBD,follow.v.23,postdate.v.01,stick_to.v.02,0.10694442965947346,0.07040292488255089,0.07723343236819771,0.2497309625305537,0.0680961413326173,1,0,0.4789948460131584,0.42276390454174584,0.06250710819315473,0.2565078998570551,0.46073763669457035,0.44775421407177074,0.5843024010758049,0.6288858563599422,0.1467460403716704,False
40269,brown1/tagfiles/br-j06.xml_9,18,followed,postdate.v.01,It should be possible to prepare very pure chlorine by oxidation of inorganic chlorides on a vacuum system,by multiple distillation of the liquid .,True,It should be possible to prepare very pure chlorine by oxidation of inorganic chlorides on a vacuum system followed by multiple distillation of the liquid .,156,VBD,follow.v.01,postdate.v.01,stick_to.v.02,0.10694442965947346,0.07040292488255089,0.07723343236819771,0.2497309625305537,0.0680961413326173,1,1,0.6489665691691128,0.5742207065209444,0.06250710819315473,0.2565078998570551,0.6230125672340827,0.2573686355207133,0.7023173206731693,0.5122820975499586,0.2535688094105358,False
9933,brown1/tagfiles/br-c01.xml_17,3,follows,postdate.v.01,`` Parsifal '',"July 25 , with Hans Knappertsbusch conducting , and he also conducts `` Die Meistersinger '' , to be presented Aug. 8 and 12 .",True,"`` Parsifal '' follows July 25 , with Hans Knappertsbusch conducting , and he also conducts `` Die Meistersinger '' , to be presented Aug. 8 and 12 .",149,VBZ,stick_to.v.02,postdate.v.01,stick_to.v.02,0.10411993952215973,0.07692206364719555,0.0637476780283757,0.1987843495248446,0.07542456598567722,1,1,0.9705859111789596,1.0,0.056559486491244586,0.1329471870547735,0.9754545801430847,0.1484241678603496,0.8868563061745599,0.22002475946322178,0.20928834787114398,False
7206,brown1/tagfiles/br-a15.xml_83,20,led,precede.v.04,"Mantle , the bull-necked blond switch-hitter , had one sensational triple-crown season , 1959 , when he batted .365 and also","the American League in home runs , 52 , and RBIs , 130 .",True,"Mantle , the bull-necked blond switch-hitter , had one sensational triple-crown season , 1959 , when he batted .365 and also led the American League in home runs , 52 , and RBIs , 130 .",185,VBN,head.v.02,lead.v.01,moderate.v.01,0.14775624381876953,0.10319483218980957,0.10755271012173606,0.15042278993497002,0.21231650296999666,12,1,0.12802679968890676,0.11237180975422388,0.3086190318513187,0.16688854761917635,0.1343825706274852,0.1976023257208201,0.9255493549181625,0.7519682962779667,0.1401829557435878,False
3176,brown1/tagfiles/br-a12.xml_3,27,favored,prefer.v.03,Moritz does n't even have a nose guard or hip pads but he 's one of the most valuable members of the Longhorn team that will be heavily,Saturday over Oklahoma in the cotton bowl .,False,Moritz does n't even have a nose guard or hip pads but he 's one of the most valuable members of the Longhorn team that will be heavily favored Saturday over Oklahoma in the cotton bowl .,187,VBN,favor.v.03,favor.v.02,favored.s.01,0.36840477287776846,0.12339377286220934,0.26087218347931035,0.19698678024508423,0.3449084458552543,0,1,0.22721640997499726,0.33249251379950484,0.5458359015628,0.19698678024508423,0.3459261424679169,0.3524987973681809,0.4797961890198279,0.4774082361101837,0.054851669442272814,True
9666,brown1/tagfiles/br-b20.xml_89,24,trained,prepare.v.05,"The girls , very fetching in their uniforms , are shown firing rockets from a launcher mounted on a dump truck ; they are also","with carbines , automatic weapons , pistols , rifles and other such ladies ' accessories .",True,"The girls , very fetching in their uniforms , are shown firing rockets from a launcher mounted on a dump truck ; they are also trained with carbines , automatic weapons , pistols , rifles and other such ladies ' accessories .",225,VBN,trained.a.01,train.v.02,trained.a.01,0.17094208948885742,0.0940197571574101,0.07147358758117991,0.3956521484845927,0.24011049301317133,3,1,0.06399486803746689,0.1610464524730266,0.2818724666373643,0.10180087780376597,0.14027682906815372,0.21097828852337017,0.46294865269326135,0.5875061060454799,0.35495761288501243,False
37518,brown1/tagfiles/br-j03.xml_68,4,published,print.v.01,There are no data,in the literature on the shape of low viscosity drops to confirm the above formulas .,True,There are no data published in the literature on the shape of low viscosity drops to confirm the above formulas .,113,VBN,promulgated.s.01,publish.v.02,promulgated.s.01,0.38693279076247156,0.08070931875207982,0.12109958321087123,0.2171922080460617,0.1916923707143716,0,0,0.22629665703895838,0.11936184273640374,0.30257309811300076,0.2171922080460617,0.25028320626978784,0.28944635554248577,0.7736791660246211,0.449700336526268,1.0,False
1044,brown1/tagfiles/br-a01.xml_88,2,went,proceed.v.04,`` Everything,"real smooth '' , the sheriff said .",True,"`` Everything went real smooth '' , the sheriff said .",54,VBD,proceed.v.04,go.v.02,fail.v.04,0.1038303419881525,0.09293169268624746,0.08335847298854905,0.06632331518344836,0.1401718599066928,7,0,0.19411490990743374,0.15717175551589913,0.19891612934980202,0.1856972799378928,0.2201490821471197,0.3510642924583537,0.4667005442810738,0.6594134390921071,0.11570116311335824,False
43490,brown1/tagfiles/br-j08.xml_78,9,produced,produce.v.01,It is possible that certain mutational forms may be,such as antibiotic resistant strains .,False,It is possible that certain mutational forms may be produced such as antibiotic resistant strains .,99,VBN,produce.v.02,produce.v.02,grow.v.08,0.13691016431723324,0.16199500185308696,0.06815767000914995,0.19601871486039552,0.08687516888392881,0,0,0.2189724990869586,0.22352148435048802,0.6843094812679656,0.19601871486039552,0.3367449647421746,0.24994100655795148,0.6266306905472032,0.4463889360058852,0.6843094812679656,True
35559,brown1/tagfiles/br-j02.xml_19,3,producing,produce.v.01,The pressure gradient,the jet is due to the nature of the magnetic field in the arc ( rapid decrease of current density from cathode to the anode ) .,True,The pressure gradient producing the jet is due to the nature of the magnetic field in the arc ( rapid decrease of current density from cathode to the anode ) .,159,VBG,grow.v.07,produce.v.02,grow.v.08,0.17069285007794008,0.16873008069535841,0.0731061078858553,0.2260972268405737,0.07769532230186568,0,0,0.17679573145378985,0.1476588604737616,0.6572309843971453,0.2260972268405737,0.22309144002128894,0.2616894399731084,0.5365201665802989,0.39455464965994935,0.17229007331942414,False
34359,brown1/tagfiles/br-h01.xml_77,3,produced,produce.v.02,If nothing is,", there is no obligation to repay .",True,"If nothing is produced , there is no obligation to repay .",58,VBN,produce.v.04,produce.v.02,grow.v.08,0.13691016431723324,0.16199500185308696,0.06815767000914995,0.19601871486039552,0.08687516888392881,1,0,0.1441254960477852,0.19716050467295015,0.6843094812679656,0.2542703469288168,0.2839830530127966,0.24830479676497053,0.5248127892910573,0.6308715203181482,0.6843094812679656,False
21378,brown1/tagfiles/br-e21.xml_6,6,made,produce.v.02,The new editions of topographic maps being,by the federal government are excellent for orienting yourself to the natural features of the site .,True,The new editions of topographic maps being made by the federal government are excellent for orienting yourself to the natural features of the site .,148,VBN,draw.v.04,make.v.02,made.s.03,0.13009964218207648,0.11703058273516692,0.10451405334079683,0.17597501507888996,0.18168201704317577,5,0,0.18396587217354918,0.1451664765031512,0.18863045393263936,0.23734887585089723,0.19564522206661636,0.30498287964449206,0.46206735304769814,0.6102726717686888,0.7246420764479289,False
16569,brown1/tagfiles/br-d04.xml_17,15,made,produce.v.02,"For ' God had not rained ' , says the Scripture , before man was",", ' and there was no man to till the earth ' .",True,"For ' God had not rained ' , says the Scripture , before man was made , ' and there was no man to till the earth ' .",116,VBN,made.s.01,make.v.02,made.s.03,0.13009964218207648,0.11703058273516692,0.10451405334079683,0.17597501507888996,0.18168201704317577,5,0,0.09247983934780697,0.13648283914530995,0.18863045393263936,0.23734887585089723,0.12806145434605068,0.3530890063463176,0.3761032397259385,0.6316426889714201,0.7246420764479289,False
3,brown1/tagfiles/br-a01.xml_0,11,produced,produce.v.04,The Fulton County Grand Jury said Friday an investigation of Atlanta 's recent primary election,`` no evidence '' that any irregularities took place .,True,The Fulton County Grand Jury said Friday an investigation of Atlanta 's recent primary election produced `` no evidence '' that any irregularities took place .,159,VBN,produce.v.03,produce.v.02,grow.v.08,0.13691016431723324,0.16199500185308696,0.06815767000914995,0.19601871486039552,0.08687516888392881,3,0,0.12516629295799278,0.07864424499372509,0.6843094812679656,0.22901400420936652,0.1588278077195222,0.15533915108856886,0.5777537038906098,0.26415186923316536,0.035155254493884,False
32199,brown1/tagfiles/br-g11.xml_81,20,gained,profit.v.01,"The persistent horror of having a malformed child has , I believe , been reduced , not because we have","any control over this misfortune , but precisely because we have learned that we have so little control over it .",True,"The persistent horror of having a malformed child has , I believe , been reduced , not because we have gained any control over this misfortune , but precisely because we have learned that we have so little control over it .",223,VBN,derive.v.02,acquire.v.05,gain.v.09,0.15404208205230713,0.16599692308959563,0.08145340315906786,0.250688880420817,0.1272024205470645,2,1,0.11862316649916298,0.09686434618135857,0.0884038298684687,0.2795597434982407,0.11725336611076985,0.25406047490415196,0.49734568256959827,0.49368131977491153,0.16998690665628619,False
29007,brown1/tagfiles/br-f43.xml_24,12,projected,project.v.04,"Physically , a movie is possible because a series of images is",one at a time at such a speed that the eye `` remembers '' the one that has gone before even as it registers the one now appearing .,True,"Physically , a movie is possible because a series of images is projected one at a time at such a speed that the eye `` remembers '' the one that has gone before even as it registers the one now appearing .",205,VBN,project.v.04,stick_out.v.01,jutting.s.01,0.1746690734197813,0.09392950455131652,0.07695238058911806,0.08085452150881751,0.24368918417594432,3,1,0.09774842693315086,0.12768221043101033,0.21310529323889799,0.26746383377233524,0.12275654998853543,0.27138932725202997,0.6583601917000083,0.6158450639311891,0.21310529323889799,False
17098,brown1/tagfiles/br-d04.xml_48,6,promised,promise.v.01,"In any case , though they had been","immortality if they ate of the tree , they obtained mortality instead .",False,"In any case , though they had been promised immortality if they ate of the tree , they obtained mortality instead .",115,VBN,promise.v.04,promise.v.02,promise.v.04,0.18854918367165063,0.0935799323325872,0.1115988859004358,0.3737498169726544,0.258359647642529,0,0,0.1907635759413365,0.19339509076308303,0.6022366483781346,0.3737498169726544,0.25947974248773314,0.32511037509594914,0.5176296538133849,0.6413528416221288,0.6022366483781346,True
9524,brown1/tagfiles/br-b20.xml_79,4,promised,promise.v.01,"In a sense , the showdown","by Mr. Hammarskjold 's sudden and tragic death has been avoided ; no precedents have been set as yet ; structurally , the U.N. is still fluid , vulnerable to the pressures that its new and enlarged membership are bringing to bear upon it .",False,"In a sense , the showdown promised by Mr. Hammarskjold 's sudden and tragic death has been avoided ; no precedents have been set as yet ; structurally , the U.N. is still fluid , vulnerable to the pressures that its new and enlarged membership are bringing to bear upon it .",274,VBN,promise.v.04,promise.v.02,promise.v.04,0.18854918367165063,0.0935799323325872,0.1115988859004358,0.3737498169726544,0.258359647642529,0,1,0.19098248930046413,0.17132252189341188,0.6022366483781346,0.3737498169726544,0.21629725116061213,0.18389320212737642,0.7559594158315082,0.6536967602022957,0.6022366483781346,True
12360,brown1/tagfiles/br-c04.xml_52,17,proved,prove.v.02,"Berman , whose fame has rested in recent years on his skills as a night club monologist ,",himself very much at home in musical comedy .,True,"Berman , whose fame has rested in recent years on his skills as a night club monologist , proved himself very much at home in musical comedy .",142,VBN,rise.v.15,prove.v.02,proved.a.01,0.18879262311209632,0.13108712230246033,0.15909510290884424,0.36046289566854994,0.35233450183778603,1,1,0.24026526635743342,0.22136464406332818,0.7048648402656145,0.18728299768679602,0.3016803262986218,0.3264577493810202,0.6153046381143749,0.7124452593001027,0.2436038720090649,False
